{
  "task_id": "task_demo_000000000001",
  "intent_id": "intent_demo_000000000001",
  "objective": "Execute the authorized demo swap, finalize one effect, and keep settled notional within $50.",
  "criteria": [
    {
      "path": "effect_id",
      "op": "present",
      "value": true
    },
    {
      "path": "status",
      "op": "eq",
      "value": "FINALIZED"
    },
    {
      "path": "amount_usd",
      "op": "lte",
      "value": "50"
    }
  ],
  "issued_at": "2026-08-30T18:01:00+00:00",
  "expires_at": "2026-08-30T18:06:00+00:00"
}
